date,momism,mommentary,definition,example,filename,alt,order,links,Backup1,Backup2,
2020-06-01,Volunteer,"""Volunteers"" is (or was) just ordinary gardening jargon. I have no idea how commonly used the word is in the modern era, especially outside the south...",A plant that grows spontaneously in the garden,"I planted these and those, but those mystery flowers and the tomatoes are both volunteers!",volunteer.png,Volunteer anyone?,247,<img class='img_small' src='/assets/images/volunteer.png' alt='Volunteer anyone?'>,,,
2011-11-11,Were you raised in a barn?,Momism of the year: 2017.,,"Eating with your fingers, were you raised in a barn? Kids: yes!",barn.jpg,Barn,157,<img class='img_small' src='/assets/images/barn.jpg' alt='Barn'>,,,
2021-04-03,What is the <b>matter</b> with you?,,"""Gadzooks!"" Mom demands ""what is the <b>matter</b> with you"" with a ""head of steam"" when she wants to know what ""hare brained scheme"" we ""dubious"" youngsters are ""getting up to"", and whether we're ""in cahoots"" or ""roaring around"" alone","Huh-what is the <b>matter</b> with you, feline — do you have kibbles for brains or are you just suicidal?",Moonbeam_UFO.jpeg,UFO,279,<img class='img_small' src='/assets/images/Moonbeam_UFO.jpeg' alt='UFO'>,,,
2021-07-16,What is this world coming to?,"The kids discovered this momism straight from the source in her response to baby doll's proposal that ""mind boggling"" is a momism",Expression of disbelief and often disapproval of how the times are a-changin',"""Pink polka dots on a lime green dress?! Huh-what is this world coming to??""",Moonbeam_UFO.jpeg,UFO,296,<img class='img_small' src='/assets/images/Moonbeam_UFO.jpeg' alt='UFO'>,,,
2019-07-24,What-all,,Plural of what,I have no clue as to huh-what-all you-all saw,barn.jpg,Barn,222,<img class='img_small' src='/assets/images/barn.jpg' alt='Barn'>,,,
2016-02-21,Whifflebrain,,Airhead,,fog.jpg,Fog,204,<img class='img_small' src='/assets/images/fog.jpg' alt='Fog'>,,,
2009-04-14,White knuckle trip,,A terrifying journey,,hair-raising.jpg,Hair raising,078,<img class='img_small' src='/assets/images/hair-raising.jpg' alt='Hair raising'>,,,
2019-07-24,Who-all,Referring to the likelihood that the answer to the question has several parts,Plural of who,Who-all did you-all go to France with?,roost.jpg,Roost,223,<img class='img_small' src='/assets/images/roost.jpg' alt='Roost'>,,,
2009-06-14,Whole kit and kaboodle,,"A bit like the whole nine yards; the entirety of, the whole set.",,crochet.jpg,Crotchet,093,<img class='img_small' src='/assets/images/crochet.jpg' alt='Crotchet'>,,,
2010-12-22,Whole shebangdasium,"Kind of like ""the whole nine yards""","The whole shebang, everything, the entire thing",,Moonbeam_UFO.jpeg,UFO,134,<img class='img_small' src='/assets/images/Moonbeam_UFO.jpeg' alt='UFO'>,,,
2009-12-01,Whole shooting match,"My daughter caught herself saying it the other day, then I said it today",The whole thing,"With my terrific niece and nephews I've got it all, the whole shooting match!",Breaking_technique.jpg,Breaking blocks,106,<img class='img_small' src='/assets/images/Breaking_technique.jpg' alt='Breaking blocks'>,,,
2021-02-22,Whomp,,To hit,I'd better take a walk before we get whomped with another snowstorm,Breaking_technique.jpg,Breaking blocks,274,<img class='img_small' src='/assets/images/Breaking_technique.jpg' alt='Breaking blocks'>,,,
2022-09-10,Wild and woolly,,Unkempt,"Might be time for a haircut, sonnn, you are looking wild and woolly!",rear.jpg,Rear,342,<img class='img_small' src='/assets/images/rear.jpg' alt='Rear'>,,,
2012-09-26,Wink,,A brief nap,I'm going to grab a quick wink,wink.avif,Wink,178,<img class='img_small' src='/assets/images/wink.avif' alt='Wink'>,,,
2012-03-24,Within an inch of his life,,,,Breaking_technique.jpg,Breaking blocks,163,<img class='img_small' src='/assets/images/Breaking_technique.jpg' alt='Breaking blocks'>,,,
2021-10-24,Wo<b>n</b>derful,,Wonderful with emphasis on the n.,You kids cooked dinner? Wo<b>n</b>derful!,goose8.jpg,Goose,310,<img class='img_small' src='/assets/images/goose8.jpg' alt='Goose'>,,,
2021-02-27,Wonders never cease,,"This is a surprising turn of events, how out of character for you","Wonders never cease! First, adolescent life before noon and <b>now</b> you're doing the dishes willingly?",Moonbeam_UFO.jpeg,UFO,275,<img class='img_small' src='/assets/images/Moonbeam_UFO.jpeg' alt='UFO'>,,,
2021-06-08,World-conquering,,Exclamation. Usually indicating an extremely determined baby,World conquering! That baby isn't gonna give up on walking,bad_cattitude.jpg,A bad cattitude,292,<img class='img_small' src='/assets/images/bad_cattitude.jpg' alt='A bad cattitude'>,,,
2021-05-07,Worrisome,,Concerning,That half of American voters would choose George the Younger is worrisome in my view,kabroken.jpg,Broken pot,285,<img class='img_small' src='/assets/images/kabroken.jpg' alt='Broken pot'>,,,
2009-02-20,Worrywart,,"Someone with a tendency to worry habitually, often needlessly",,hair-raising.jpg,Hair raising,057,<img class='img_small' src='/assets/images/hair-raising.jpg' alt='Hair raising'>,,,
2009-04-17,Ye gods and little fishes,,(Exclamation),Ye gods and little catfish!,bad_cattitude.jpg,A bad cattitude,083,<img class='img_small' src='/assets/images/bad_cattitude.jpg' alt='A bad cattitude'>,,,
2019-04-13,Yea high,,"Indicates that something is as high as mom is pointing, usually not very high",That cat went past the wall about yea high [mom points] with that paintbrush in her mouth,goose8.jpg,Goose statue,219,<img class='img_small' src='/assets/images/goose8.jpg' alt='Goose statue'>,,,
2011-05-07,"Yes, cat. no, cat. maybe, cat","I think that one evolved during life with Milo, who I also referred to as ""The Mouthy One"" since she was always giving me an earful. Momism?",Expression of sarcastic subordination to the cat,,bad_cattitude.jpg,A bad cattitude,148,<img class='img_small' src='/assets/images/bad_cattitude.jpg' alt='A bad cattitude'>,,,
2012-11-29,You have such a good [body part] for [task],,Mother's preferred momism for describing an extraordinary skill,"Dearheart, you have such a good eye for composition / Son, you have a great ear for idiosyncrasy",wink.avif,Wink,180,<img class='img_small' src='/assets/images/wink.avif' alt='Wink'>,,,
2009-02-04,Your name is dog,,Your name is mud (cat version),,bad_cattitude.jpg,A bad cattitude,038,<img class='img_small' src='/assets/images/bad_cattitude.jpg' alt='A bad cattitude'>,,,
2009-02-04,Your name is mud,,You're in trouble,,name-mud.jpg,Person submerged in mud,037,<img class='img_small' src='/assets/images/name-mud.jpg' alt='Person submerged in mud'>,,,
2009-06-13,Zonked,,Tired,That (sleeping) baby is zonked! ,zzz.webp,Zzz,089,<img class='img_small' src='/assets/images/zzz.webp' alt='Zzz'>,,,
2012-02-17,Zories,"""Gadzooks!"" Mom demands ""huh-what is the <b>matter</b> with you"" with a ""head of steam"" when she wants to know what ""hare brained scheme"" we ""dubious"" youngsters are ""getting up to"", and whether we're ""in cahoots"" or ""roaring around"" alone","Japanese-style flip-flops, often made of woven rice straw, sort of like tatamis you can wear on your feet",,flip-flops.webp,Flip flops,161,<img class='img_small' src='/assets/images/flip-flops.webp' alt='Flip flops'>,,,
2010-09-13,Zowie,Mother-identified momism,(Exclamation),,Moonbeam_UFO.jpeg,UFO,122,<img class='img_small' src='/assets/images/Moonbeam_UFO.jpeg' alt='UFO'>,,,