date,momism,mommentary,definition,example,filename,alt,order,links,Backup1,Backup2,
2023-01-07,Off the wall,"An ""off the wall sense of humor"" is the first example that occurred to me! ",Highly unusual,That off-the-wall sense of humor,wall_bounce.jpg,Wall bouncing,349,<img class='img_small' src='/assets/images/wall_bounce.jpg' alt='Wall bouncing'>,,,
2012-02-17,Oldie but a goodie,,A classic,,busybox.jpg,Busybox,160,<img class='img_small' src='/assets/images/busybox.jpg' alt='Busybox'>,,,
2021-09-24,Oldster,,"Opposite of youngster, an elderly person",An oldster like me can't go up and down those hills like you kids can,godfather.jpg,The Godfather,306,<img class='img_small' src='/assets/images/godfather.jpg' alt='The Godfather'>,,,
2011-03-13,On a jag,,,,nuclear_blast.jpg,Nuclear blast,144,<img class='img_small' src='/assets/images/nuclear_blast.jpg' alt='Nuclear blast'>,,,
2016-09-24,On the horn,,On the phone,,horn.jpg,Horn,209,<img class='img_small' src='/assets/images/horn.jpg' alt='Horn'>,,,
2021-03-30,On your case about,,To nag,"So long as you smell, I'm going to be on your case about wearing deodorant",AlCapone.jpg,Al Capone,278,<img class='img_small' src='/assets/images/AlCapone.jpg' alt='Al Capone'>,,,
2022-03-10,Operation,,A business,That operation over on Devon.,AlCapone.jpg,Al Capone,328,<img class='img_small' src='/assets/images/AlCapone.jpg' alt='Al Capone'>,,,
2009-01-29,Ornery,,Grumpy or irritable,,bad_cattitude.jpg,A bad cattitude,022,<img class='img_small' src='/assets/images/bad_cattitude.jpg' alt='A bad cattitude'>,,,
2022-12-22,Ought to do the trick,,"Your proposed solution will likely resolve the problem, that should suffice",I'll use this sticky tack to keep your cabinet door from banging against the wall. That ought to do the trick,Breaking_technique.jpg,Breaking blocks,345,<img class='img_small' src='/assets/images/Breaking_technique.jpg' alt='Breaking blocks'>,,,
2009-01-27,Out of commission,,"Not working, out of order",The internet is out of commission until my router gets fixed.,zzz.webp,Zzz,002,<img class='img_small' src='/assets/images/zzz.webp' alt='Zzz'>,,,
2020-05-29,Out of the blue,Idiom: a bolt from the blue?,"Out of nowhere, suddenly",,Moonbeam_UFO.jpeg,UFO,245,<img class='img_small' src='/assets/images/Moonbeam_UFO.jpeg' alt='UFO'>,,,
2009-02-25,Out of this world,,Excellent,,airdish.jpg,Dish array,059,<img class='img_small' src='/assets/images/airdish.jpg' alt='Dish array'>,,,
2009-01-27,Oy vey,,Mom's Yiddish streak: expresses annoyance,,rabbi.jpg,Rabbi,003,<img class='img_small' src='/assets/images/rabbi.jpg' alt='Rabbi'>,,,
2009-04-15,Pain in the neck,Momism partially by virtue of how often mom says it,Irritating,,bad_cattitude.jpg,A bad cattitude,079,<img class='img_small' src='/assets/images/bad_cattitude.jpg' alt='A bad cattitude'>,,,
2022-03-10,Pardon my boardinghouse reach,Definition right from the source,To reach across a table to get something rather than asking for it to be passed,,beans.jpg,Beans,323,<img class='img_small' src='/assets/images/beans.jpg' alt='Beans'>,,,
2021-06-01,Park oneself on,"I  think that huh-when I come up with a momism (give or take), I'm oftentimes trying to make an ordinary turn of phrase into something more interesting. ""Get"" is pretty ho-hum, ""fetch"" is a more interesting (& less often-used) equivalent; ""sit,"" yawn, ""park oneself,"" say huh-what? I'm trying to fight linguistic boredom one momism at a time.",To sit,I’m going to go park myself on a bench by Lake Michigan huh-while you three go to the bathroom.,Moonbeam_UFO.jpeg,UFO,290,<img class='img_small' src='/assets/images/Moonbeam_UFO.jpeg' alt='UFO'>,,,
2021-08-24,Peace and quiet,Other people don't say this?,"Peace and/or quiet, tranquillity","From now on, I want peace and quiet or else your name is mud",bell.jpg,Bell,298,<img class='img_small' src='/assets/images/bell.jpg' alt='Bell'>,,,
2021-05-12,Perch,,"Spot, lookout point",The cat's favorite perch on the stairway,bad_cattitude.jpg,A bad cattitude,287,<img class='img_small' src='/assets/images/bad_cattitude.jpg' alt='A bad cattitude'>,,,
2010-05-31,Persnickety,,Picky,,bad_cattitude.jpg,A bad cattitude,117,<img class='img_small' src='/assets/images/bad_cattitude.jpg' alt='A bad cattitude'>,,,
2017-12-30,Photo hobby,,Mother's love of photography,You know me and my photo hobby,goose3.jpg,Goose,213,"<img class='img_small' src='/assets/images/goose1.jpg' alt='St. Pats Goose'>, <img class='img_small' src='/assets/images/goose2.jpg' alt='Jailbird'>, <img src='/assets/images/goose3.jpg' alt='Medical worker' class='img_small'>, <img class='img_small' src='/assets/images/goose4.jpg' alt='Strawbirdy'>, <img class='img_small' src='/assets/images/goose5.jpg' alt='Patriot goose'>, <img class='img_small' src='/assets/images/goose6.jpg' alt='Dunno goose'>, <img class='img_small' src='/assets/images/goose7.jpg' alt='Christmas goose'>, <img class='img_small' src='/assets/images/goose8.jpg' alt='Michi-goose'>","goose1.jpg, goose2.jpg, goose3.jpg, goose4.jpg, goose5.jpg, goose6.jpg, goose7.jpg","<img class='img_small' src='/assets/images/goose1.jpg' alt='St. Pats Goose'>, <img class='img_small' src='/assets/images/goose2.jpg' alt='Jailbird'>, <img src='/assets/images/goose3.jpg' alt='Medical worker' class='img_small'>, <img class='img_small' src='/assets/images/goose4.jpg' alt='Strawbirdy'>, <img class='img_small' src='/assets/images/goose5.jpg' alt='Patriot goose'>, <img class='img_small' src='/assets/images/goose6.jpg' alt='Dunno goose'>, <img class='img_small' src='/assets/images/goose7.jpg' alt='Christmas goose'>, <img class='img_small' src='/assets/images/goose8.jpg' alt='Michi-goose'>","<img class='img_small' src='/assets/images/goose1.jpg' alt='St. Pats Goose'>, <img class='img_small' src='/assets/images/goose2.jpg' alt='Jailbird'>, <img src='/assets/images/goose3.jpg' alt='Medical worker' class='img_small'>, <img class='img_small' src='/assets/images/goose4.jpg' alt='Strawbirdy'>, <img class='img_small' src='/assets/images/goose5.jpg' alt='Patriot goose'>, <img class='img_small' src='/assets/images/goose6.jpg' alt='Dunno goose'>, <img class='img_small' src='/assets/images/goose7.jpg' alt='Christmas goose'>, <img class='img_small' src='/assets/images/goose8.jpg' alt='Michi-goose'>"
2009-04-23,Piece of work,,"Adjective meaning someone is unusually unpleasant, difficult, or behaves particularly badly","You're a piece of work, lovey",bad_cattitude.jpg,A bad cattitude,087,<img class='img_small' src='/assets/images/bad_cattitude.jpg' alt='A bad cattitude'>,,,
2013-03-15,Pipe down,Mom identified this momism,Quiet down,,busybox.jpg,Busybox,188,<img class='img_small' src='/assets/images/busybox.jpg' alt='Busybox'>,,,
2010-12-22,Pitching a fit,,"Become extremely upset or angry in a loud and uncontrolled way, having a tantrum, making a scene",,bad_cattitude.jpg,A bad cattitude,132,<img class='img_small' src='/assets/images/bad_cattitude.jpg' alt='A bad cattitude'>,,,
2009-01-29,Poke around,,"To look around, to look through things, to investigate",I'm going to go poke around the Chalet,dune-buggy.jpg,Dune buggy,025,<img class='img_small' src='/assets/images/dune-buggy.jpg' alt='Dune buggy'>,,,
2014-12-28,Pole-axed,,Exhausted,,zzz.webp,Zzz,198,<img class='img_small' src='/assets/images/zzz.webp' alt='Zzz'>,,,
2012-04-24,Polish off,,Eat the rest of a dish,Your brother polished off those bagels in one sitting.,polish-off.jpg,Polish off,169,<img class='img_small' src='/assets/images/polish-off.jpg' alt='Polish off'>,,,
2020-05-10,Pop awake,,Wake up,I pop awake every morning at quarter to five,Popcorn.webp,Popcorn,238,<img class='img_small' src='/assets/images/Popcorn.webp' alt='Popcorn'>,,,
2011-03-22,Post-adolescent life,Usage: [insert the blank] life.,Good morning.,Post-adolescent life!,Alien_1.webp,Alien,145,<img class='img_small' src='/assets/images/Alien_1.webp' alt='Alien'>,,,
2022-05-17,"Problems, you've got problems","Problems, you've got problems is my sympathetic way of suggesting there might be some melodrama involved. It has a Yiddish-English flavor to it. I have no idea where I acquired such a useful phrase, but there've been a lot of Jewish people in my life. With this one, I visualize Linda Harris's mom (college friend whose parents lived in Durham; I visited them for years after she moved away).","You're being melodramatic, mom has no sympathy for whatever you're complaining about","""I stayed up too late last night and now I'm tired and still have to go to school and take an exam I'm not ready for"" ""Problems, you've got problems, baby!""",Alien_1.webp,Alien,333,<img class='img_small' src='/assets/images/Alien_1.webp' alt='Alien'>,,,
2021-07-15,Promising,All things are either promising or not promising,Something that has good future prospects,"Hmm, that pitch black sky on the horizon doesn't look too promising!",cookie-monster.jpg,Cookie Monster,295,<img class='img_small' src='/assets/images/cookie-monster.jpg' alt='Cookie Monster'>,,,
2021-10-25,Pushing it,"""Pushing your luck"" I most likely acquired from my mom. ""Pushing it"" I'm not so sure, maybe just me playing with language. In my mind, they both mean the same thing, but I would only say ""you're pushing it"" to someone who already knew about ""pushing your luck,"" my kids, e.g.","Pushing your luck, you're an inch from being in serious trouble","""Mom, can we go to Walker Bros this weekend?"" ""Oh alright, it's been a huh-while since we had a treat like that!"" ""Can we go for ice cream afterwards?"" ""Now you're pushing it, Annebeth! Pick one.""",cookie-monster.jpg,Cookie Monster,311,<img class='img_small' src='/assets/images/cookie-monster.jpg' alt='Cookie Monster'>,,,
2013-03-15,Put a lid on it,Mom self-identified this momism,"Exclamation: to be quiet, shut up",,busybox.jpg,Busybox,187,<img class='img_small' src='/assets/images/busybox.jpg' alt='Busybox'>,,,
2009-02-07,Put hair on your chest,Mom identified this momism,,,chest-hair.webp,Chest hair,046,<img class='img_small' src='/assets/images/chest-hair.webp' alt='Chest hair'>,,,
2009-09-28,Put that into your equation,(Lowell-ism),Consider that,,question_mark.png,Question mark,095,<img class='img_small' src='/assets/images/question_mark.png' alt='Question mark'>,,,
2009-01-29,Put the kibosh on,,To cancel,,Moonbeam_UFO.jpeg,UFO,027,<img class='img_small' src='/assets/images/Moonbeam_UFO.jpeg' alt='UFO'>,,,
2020-05-09,Quit it,,Stop that,"Quit it, your squabbling is driving me bonkers",zzz.webp,Zzz,236,<img class='img_small' src='/assets/images/zzz.webp' alt='Zzz'>,,,
2021-09-13,Rabble rousing,"The verb, not the noun, is a momism.",Someone who causes trouble,"Quit your rabble rousing, son! Can't your old mama have a moment's peace without you stirring up trouble?!",Breaking_technique.jpg,Breaking blocks,301,<img class='img_small' src='/assets/images/Breaking_technique.jpg' alt='Breaking blocks'>,,,
2021-04-04,Racket,,Making loud and continuous noise ,Quit making such a racket; I can't hear myself think,racket.JPG,Racket,282,<img class='img_small' src='/assets/images/racket.JPG' alt='Racket'>,,,
2013-09-10,Rattling around,,Awake and moving around the house,I could hear him rattling around long after I turned into a pumpkin,rattle.jpg,Rattle,192,<img class='img_small' src='/assets/images/rattle.jpg' alt='Rattle'>,,,
2020-04-19,Really the pits,,Extremely unpleasant or boring,This COVID situation is really the pits,anchor.jpg,Anchor,233,<img class='img_small' src='/assets/images/anchor.jpg' alt='Anchor'>,,,
2020-05-20,Rear,,The buttocks,Your brother was a pain in the rear when he was little,rear.jpg,Jeans,244,<img class='img_small' src='/assets/images/rear.jpg' alt='Jeans'>,,,
2015-03-10,Recipe for disaster,,Something that is likely to result in disaster,,bad_cattitude.jpg,A bad cattitude,200,<img class='img_small' src='/assets/images/bad_cattitude.jpg' alt='A bad cattitude'>,,,
2009-10-11,Regular gulley-washer,"A regular gully-washer means it was a doozy of a rainstorm. The gully-washer is from the Texas side of the family, I believe.",A powerful rainstorm,"Mom: ""It was a regular gully washer!"" Me: ""What's a gully washer?"" Mom: ""It's a momism, dear""",Umbrella.png,Umbrella,099,<img class='img_small' src='/assets/images/Umbrella.png' alt='Umbrella'>,,,
2021-05-26,Ride herd on,,"Surveil, keep close watch on",Make sure someone rides herd on you after your vaccine,horse.webp,Horse,289,<img class='img_small' src='/assets/images/horse.webp' alt='Horse'>,,,
2023-03-26,Rip-roaring around ,,Moving at an alarming pace,Your brother came rip-roaring around the corner,lion.jpg,Lion,352,<img class='img_small' src='/assets/images/lion.jpg' alt='Lion'>,,,
2009-01-29,Roaring around,,,,lion.jpg,Lion,014,<img class='img_small' src='/assets/images/lion.jpg' alt='Lion'>,,,
2009-02-08,"Roll up your pants, it's too late to save your shoes",,,,Umbrella.png,Umbrella,051,<img class='img_small' src='/assets/images/Umbrella.png' alt='Umbrella'>,,,
2018-07-12,Roost,Seems to me a perch is more temporary,"To sit, rest",I'm looking for a bench upon which to roost,roost.jpg,Roost,215,<img class='img_small' src='/assets/images/roost.jpg' alt='Roost'>,,,
2009-02-07,Rotten in Denmark,That's from Shakespeare,,,green_apple.jpg,Green Apple,045,<img class='img_small' src='/assets/images/green_apple.jpg' alt='Green Apple'>,,,
2009-01-28,Ruckus,,Making a lot of noise,,roost.jpg,Roost,007,<img class='img_small' src='/assets/images/roost.jpg' alt='Roost'>,,,
2009-04-14,Ruffled his feathers,,To have irritated or offended someone,,goose8.jpg,Goose,075,<img class='img_small' src='/assets/images/goose8.jpg' alt='Goose'>,,,
2009-04-18,Sanford Sharpie,,A permanent marker,,sharpie.jpg,Sharpie,085,<img class='img_small' src='/assets/images/sharpie.jpg' alt='Sharpie'>,,,
2020-11-09,Scads,"Other people don't say ""scads""? Yet another Momism surprises the Mom. &hearts;","Many, lots, an abundance of","""There are scads of people in the grocery store today"" — mom, the day before Thanksgiving",roost.jpg,Roost,262,<img class='img_small' src='/assets/images/roost.jpg' alt='Roost'>,,,
2009-04-23,Scarcer than hen's teeth,,"Extremely rare, nonexistent",,roost.jpg,Roost,086,<img class='img_small' src='/assets/images/roost.jpg' alt='Roost'>,,,
2009-04-17,Schlep,Yiddishisms live,To carry something heavy or bulky,,bagel.jpg,Bagel,080,<img class='img_small' src='/assets/images/bagel.jpg' alt='Bagel'>,,,
2010-10-07,Scream bloody murder,,Scream loudly,,lion.jpg,Lion,125,<img class='img_small' src='/assets/images/lion.jpg' alt='Lion'>,,,
2020-12-04,See huh-what I can see,"Hmm. That does sound like something I'd say. As for others saying it, no clue. The usual figure of speech is ""I'll see huh-what I can do,"" I think, so it could be I coined my version to mean what I might perceive in the future, but not work that might be done.",I have yet to gather evidence to make a conclusion on this topic but I'll look into it,"I haven't been down to the Custer Street Fair to look for birthday presents yet, but I'll see huh-what I can see",goat_beard.jpg,Goat beard,265,<img class='img_small' src='/assets/images/goat_beard.jpg' alt='Goat beard'>,,,
2020-01-26,Seen better days,,"Worn, used, decrepit",Those socks have seen better days: they’re filled with holes,lion.jpg,Lion,232,<img class='img_small' src='/assets/images/lion.jpg' alt='Lion'>,,,
2009-04-17,Shtick,,Mom's Yiddish streak: a show or an act,,bagel.jpg,Bagel,082,<img class='img_small' src='/assets/images/bagel.jpg' alt='Bagel'>,,,
2009-01-29,Skedaddle,,Leave rapidly,,lion.jpg,Lion,019,<img class='img_small' src='/assets/images/lion.jpg' alt='Lion'>,,,
2011-10-16,Smack dab in the middle,,Exactly in the middle,,square.png,Square,154,<img class='img_small' src='/assets/images/square.png' alt='Square'>,,,
2012-12-24,Smart cookie,,"Noun, an intelligent person",,cookie-monster.jpg,Cookie Monster,182,<img class='img_small' src='/assets/images/cookie-monster.jpg' alt='Cookie Monster'>,,,
2009-02-09,Snatching defeat from the jaws of victory ,That phrase was popular with respect to Duke basketball in the days before the present - successful - coach Mike Krzyzewski,"A play on the inverse phrase (snatching victory from the jaws of defeat), this momism means losing something that was nearly won",,lion.jpg,Lion,054,<img class='img_small' src='/assets/images/lion.jpg' alt='Lion'>,,,
2009-02-09,Snippy,See downright nippy,"Curt, an irritable response",,bad_cattitude.jpg,A bad cattitude,053,<img class='img_small' src='/assets/images/bad_cattitude.jpg' alt='A bad cattitude'>,,,
2021-10-02,Snooze,"I do remember settling down in the evenings to watch ""the evening snooze,"" a few minutes of Peter Jennings @5:30 p.m., zzzzz..., then final credits; then Star Trek @6:00 p.m. for a few minutes, more zzzzz..., then the credits. Funniest of all to me, though, was settling in on Saturday afternoons to watch Buffy the Vampire Slayer with baby doll: a few minutes, zzzzzzz..., waking up for the credits, then asking her about huh-what I missed. She tended to be a bit cross about clueing me in (""well, you could just stay awake and watch it for yourself"" more or less).","The news, refers to the fact that mom routinely falls asleep while watching the news or, really, anything on television",I'm going to go watch the snooze and then we'll see about huh-what's for dinner.,zzz.webp,Zzz,307,<img class='img_small' src='/assets/images/zzz.webp' alt='Zzz'>,,,
2010-12-20,Snorkel,,To nuzzle,"Cat, quit snorkeling me! ",snorkel.jpg,Snorkel,130,<img class='img_small' src='/assets/images/snorkel.jpg' alt='Snorkel'>,,,
2019-12-22,Snuffocate,,Suffocate,Get me out of here before I snuffocate! ,snorkel.jpg,Snorkel,227,<img class='img_small' src='/assets/images/snorkel.jpg' alt='Snorkel'>,,,
2012-01-05,Soccer slides,,Slip-on sandals,,flip-flops.webp,Flip flops,159,<img class='img_small' src='/assets/images/flip-flops.webp' alt='Flip flops'>,,,
2010-04-01,Sonnnn,,"Son, with extended n sound","Sonnnn, why did you wake me from my nap?",doll.jpg,Doll,112,<img class='img_small' src='/assets/images/doll.jpg' alt='Doll'>,,,
2022-12-29,Spicer,,Someone who seeks out spicy food. ,Your mother the spicer is at it with the hit sauce again!,chemical-1293762_1280.png,Test tube,347,<img class='img_small' src='/assets/images/chemical-1293762_1280.png' alt='Test tube'>,,,
2010-11-16,Squabbling,,"To bicker, argue",,Breaking_technique.jpg,Breaking blocks,127,<img class='img_small' src='/assets/images/Breaking_technique.jpg' alt='Breaking blocks'>,,,
2022-05-14,Squared away,,"Taken care of, resolved, settled","Now that you're all squared away and ready to go to school, I'm going to go see about your brother!",square.png,Square,332,<img class='img_small' src='/assets/images/square.png' alt='Square'>,,,
2023-08-31,Stem to stern,,Comprehensive or complete ,We cleaned from stem to stern,leaves.jpg,Leaves,359,<img class='img_small' src='/assets/images/leaves.jpg' alt='Leaves'>,,,
2019-07-03,Stinker,,A contemptible or very unpleasant person or thing,That little stinker took off with my socks! ,skunk.webp,Skunk,220,<img class='img_small' src='/assets/images/skunk.webp' alt='Skunk'>,,,
2015-07-29,Stranger things have happened,,"Exclamation indicating that an idea, although unlikely, is within the realm of possibility",,Moonbeam_UFO.jpeg,UFO,202,<img class='img_small' src='/assets/images/Moonbeam_UFO.jpeg' alt='UFO'>,,,
2014-07-28,String beans,,Green beans,,bean.jpg,Bean,197,<img class='img_small' src='/assets/images/bean.jpg' alt='Bean'>,,,
2009-01-29,Suffice it to say,,It is enough to say this and no more,Suffice it to say that the judge was furious when the invitation was withdrawn,Moonbeam_UFO.jpeg,UFO,031,<img class='img_small' src='/assets/images/Moonbeam_UFO.jpeg' alt='UFO'>,,,
2021-05-11,Super duper,"I got that from my supervisor in academic medicine. He's from the Bronx: ""supa dupa!"" Huh-what ever happened to the R?",Extraordinary,Your family doctor was super duper.,cookie-monster.jpg,Cookie Monster,286,<img class='img_small' src='/assets/images/cookie-monster.jpg' alt='Cookie Monster'>,,,
2009-01-29,Sure as God made little green apples,,Certain,,green_apple.jpg,Green Apple,016,<img class='img_small' src='/assets/images/green_apple.jpg' alt='Green Apple'>,,,
2009-01-31,Sweet tooth,,Love of sugar,,green_apple.jpg,Green Apple,036,<img class='img_small' src='/assets/images/green_apple.jpg' alt='Green Apple'>,,,
2012-11-29,Swell foop,,A fell swoop,I cleaned the yard and planted flowers in one swell foop,Moonbeam_UFO.jpeg,UFO,181,<img class='img_small' src='/assets/images/Moonbeam_UFO.jpeg' alt='UFO'>,,,
2020-12-20,Take after,,"Resembles, inherited a trait",You really take after your dear old mother,bean.jpg,Bean,268,<img class='img_small' src='/assets/images/bean.jpg' alt='Bean'>,,,
2010-04-01,Take off with,,To take,,bad_cattitude.jpg,A bad cattitude,111,<img class='img_small' src='/assets/images/bad_cattitude.jpg' alt='A bad cattitude'>,,,
2018-07-12,Taken with,,To like,"My daughter was quite taken with ""woo-wee-sa.""",love.jpg,Love,217,<img class='img_small' src='/assets/images/love.jpg' alt='Love'>,,,
2012-07-11,Talk the leaves off a tree,That comes from a college roommate from Boston,Someone who often speaks at great length,,leaves.jpg,Leaves,176,<img class='img_small' src='/assets/images/leaves.jpg' alt='Leaves'>,,,
2011-02-09,Tenderizing,,Poking,"Cat, stop tenderizing me!",love.jpg,Love,141,<img class='img_small' src='/assets/images/love.jpg' alt='Love'>,,,
2022-03-04,That’s the crop,That was a common figure of speech in high school. ,"That’s all she wrote, that’s the end. ",,bean.jpg,Bean,320,<img class='img_small' src='/assets/images/bean.jpg' alt='Bean'>,,,
2020-11-09,The bottom is going to drop out,,It's going to rain really hard,,Umbrella.png,Umbrella,263,<img class='img_small' src='/assets/images/Umbrella.png' alt='Umbrella'>,,,
2009-02-25,Thee and me,,Me too,"You're annoyed because there's no cheese left? Thee and me, son.",roost.jpg,Roost,058,<img class='img_small' src='/assets/images/roost.jpg' alt='Roost'>,,,
2010-01-27,These parts,,This area or neighbourhood,,woods.webp,Wood,108,<img class='img_small' src='/assets/images/woods.webp' alt='Wood'>,,,
2010-05-11,They get along like a house afire,,They get along well,,Breaking_technique.jpg,Breaking blocks,114,<img class='img_small' src='/assets/images/Breaking_technique.jpg' alt='Breaking blocks'>,,,
2009-01-29,Tickled pink,,Very amused,,hop.webp,Hop,018,<img class='img_small' src='/assets/images/hop.webp' alt='Hop'>,,,
2009-10-11,To-do,,A party,Mom: They are really having a to-do up there. Me: That is so going on the list,Popcorn.webp,Popcorn,098,<img class='img_small' src='/assets/images/Popcorn.webp' alt='Popcorn'>,,,
2009-02-25,Tougher than boiled owl,Brown boy's all-time favourite momism,Very hard to chew,,owl.webp,Owl,061,<img class='img_small' src='/assets/images/owl.webp' alt='Owl'>,,,
2021-06-21,Transplant,We are but a flower being moved from pot to pot as we grow,"Immigrant, someone who moves from their home city/state/province/territory/country to another",I've heard McGill has groups organized for transplants like you and your brother. Wouldn't it be nice to meet fellow Americans-turned-Canadians?,bean.jpg,Bean,293,<img class='img_small' src='/assets/images/bean.jpg' alt='Bean'>,,,
2021-03-30,Trial balloon,"Oh yes, poor dear eldest child, indeed you were & still are the trial balloon. To me it meant a sort of a grand experiment. I didn't look up the definition in a thesaurus (and there was no internet back then!).",A first try,"Son, as the eldest, you're the trial balloon.",lead_balloon.jpg,Lead balloon,277,<img class='img_small' src='/assets/images/lead_balloon.jpg' alt='Lead balloon'>,,,
2021-11-13,Troop (up/down/around),"""As a noun, troop refers to a group of soldiers or a collection of people or things. As a verb, troop means to move or spend time together. The noun troupe refers specifically to a group of theatrical performers.""",To move together as a group,On Halloween I was trooping around with a lot of peopIe who I didn't know,bazooka.jpg,Bazooka,313,<img class='img_small' src='/assets/images/bazooka.jpg' alt='Bazooka'>,,,
2009-01-29,Trouper,,"A loyal, dependable worker or participant in an undertaking",,bazooka.jpg,Bazooka,013,<img class='img_small' src='/assets/images/bazooka.jpg' alt='Bazooka'>,,,
2009-01-29,Turkey,,"An inept person, usually related to mom's road rage",Who let that turkey drive,goose8.jpg,Goose statue,024,<img class='img_small' src='/assets/images/goose8.jpg' alt='Goose statue'>,,,
2009-02-04,Turn into a pumpkin,,Go to sleep,"Well, the sun is setting, son, so I'm going to go turn into a pumpkin",pumpkin.jpg,Pumpkin,040,<img class='img_small' src='/assets/images/pumpkin.jpg' alt='Pumpkin'>,,,
2023-10-15,Turn turtle,Defining one momism with another. Mom™,Capsize,"Kid: ""nose over pinfeathers,"" what does that mean? Mom: turning turtle",barn.jpg,Barn,364,<img class='img_small' src='/assets/images/barn.jpg' alt='Barn'>,,,
2009-01-29,Umpteenth time,,So many times it's impossible to count,He has played that Adagio for Strings umteen times now,Moonbeam_UFO.jpeg,UFO,026,<img class='img_small' src='/assets/images/Moonbeam_UFO.jpeg' alt='UFO'>,,,
2016-03-22,US mule,Did you know that I got the US mule from a cartoon when I was a kid; it was called Li'l Abner. It is political satire,The US Mail,,horse.webp,Horse,206,<img class='img_small' src='/assets/images/horse.webp' alt='Horse'>,,,
2022-05-29,Vintage,,1.) Something or someone of great age. 2) the age of someone or something,1. I'm becoming vintage. 2. Someone of my vintage.,busybox.jpg,Busybox,336,<img class='img_small' src='/assets/images/busybox.jpg' alt='Busybox'>,,,
